000 A 000
A
BILL_MONTH  = 201705  
CUR_MONTH   = 201706   
NEXT_MONTH1 = 201707 
NEXT_MONTH2 = 201708 
Timing is on.
CREATE LOCAL TEMP table OFR_MAIN_ASSET_A ON COMMIT PRESERVE ROWS
AS(
SELECT     P1.Asset_Row_Id
 
           ,TO_DATE('20170608'  ,'YYYYMMDD') AS Start_Dt           
           
           ,P1.Start_Dt AS Real_Start_Dt
           ,P1.Serv_Start_Dt
           ,P1.Serv_End_Dt
           ,P12.Std_Prd_Lvl4_Name
           ,P12.Std_Prd_Lvl3_Id
           ,P1.STD_PRD_LVL4_ID
           ,(CASE WHEN P1.Stat_Name IN ('现行','不活动','已暂停')
                   THEN P1.Stat_Name
                   ELSE 'err'
               END) AS  Stat_Name        
            ,(CASE WHEN P1.ODS_Stat_Name IN ('F0K','F0P') THEN '双向'       
									 WHEN P1.ODS_Stat_Name ='F0M' THEN '单向'
                   else 'err'
                    END  ) AS Owe_Suspend_Name             
            ,(CASE WHEN P1.Pre_Active_Status='预开户1' THEN '预开户'
                  WHEN P1.Pre_Active_Status='正常' THEN '正常开户'
                  ELSE P1.Pre_Active_Status
              END) AS Pre_Active_Status  
            ,P1.LATN_ID        
            ,P1.STAT_CHANGE_DT     
		FROM  BSSDATA.OFR_MAIN_ASSET_HIST_A   P1
		INNER JOIN  DMN.CAG_COM_STD_PRD_LVL4                  P12
	 
        ON  P1.Std_Prd_Lvl4_Id=P12.Std_Prd_Lvl4_Id
		
		WHERE  P1.Start_Dt<=TO_DATE('20170608'  ,'YYYYMMDD')
		AND  P1.End_Dt  >TO_DATE('20170608'  ,'YYYYMMDD')
     
		 
	     AND  P12.PRD_ID IN('40','60','50','10','70')   
	     
)
ORDER BY Asset_Row_Id,Std_Prd_Lvl4_Id
SEGMENTED BY HASH (Asset_Row_Id) ALL NODES
;
CREATE TABLE
Time: First fetch (0 rows): 17203.788 ms. All rows formatted: 17203.827 ms
CREATE LOCAL TEMP table MAIN_FREE_CORP_PAY_A ON COMMIT PRESERVE ROWS
AS(
select   Asset_Row_Id
            ,MAX(CASE WHEN P.Cdsc_Row_Id='1-19849-1' THEN 1 ELSE 0 END) AS Test_Flg
			
      FROM  BSSDATA.OFR_ASSET_CDSC_HIST_A       P  
      
	  
     WHERE  P.Stat_Name ='使用中'
	 
       AND  P.Start_Dt<=TO_DATE('20170608'  ,'YYYYMMDD')
       AND  P.End_Dt>TO_DATE('20170608' ,'YYYYMMDD')
       AND  P.Asset_Row_Id IN (SELECT Asset_Row_Id FROM OFR_MAIN_ASSET_A)
       
	   
      GROUP BY Asset_Row_Id 
)
ORDER BY (Asset_Row_Id)
SEGMENTED BY HASH (Asset_Row_Id) ALL NODES
;
CREATE TABLE
Time: First fetch (0 rows): 8988.754 ms. All rows formatted: 8988.772 ms
CREATE LOCAL TEMP table STOP_ASSET_A ON COMMIT PRESERVE ROWS
AS(
    SELECT  Asset_Row_Id
        		,MAX(CASE WHEN Call_Limit_Stat IN('F0K','F0P') THEN 1 else 0 END) AS Twoway_Stop_Flg   
    		    ,MAX(CASE WHEN Call_Limit_Stat='F0M' THEN 1 else 0 END) AS Oneway_Stop_Flg   
            ,MAX(CASE WHEN Call_Limit_Stat IN('F0K','F0P')                                         
                     
                      THEN TO_DATE('19990101' , 'YYYYMMDD')
                      ELSE cast(Deal_Time as date)
                  END ) AS Oneway_Stop_Dt
            ,MAX(CASE WHEN Call_Limit_Stat='F0M'                                        
                      
                      THEN TO_DATE('19990101' , 'YYYYMMDD')
                      ELSE cast(Deal_Time as date) 
                  END ) AS Twoway_Stop_Dt
				  
      FROM  BSSDATA.OFR_ASSET_CALL_LIMIT_LOG_A
      WHERE  cast(Deal_Time as date) <=TO_DATE('20170608'  ,'YYYYMMDD')
      
	 
       AND  Call_Limit_Stat IN('F0M','F0K','F0P')                                        
     GROUP BY Asset_Row_Id
)
ORDER BY (Asset_Row_Id)
SEGMENTED BY HASH (Asset_Row_Id) ALL NODES
;
CREATE TABLE
Time: First fetch (0 rows): 1957.030 ms. All rows formatted: 1957.049 ms
CREATE LOCAL TEMP table STOP_ASSET_1_A ON COMMIT PRESERVE ROWS
AS(
    SELECT  Asset_Row_Id
        		,MAX(CASE WHEN Call_Limit_Stat IN('F0K','F0P') THEN 1 else 0 END) AS Twoway_Stop_Flg1      
    		    ,MAX(CASE WHEN Call_Limit_Stat='F0M' THEN 1 else 0 END) AS Oneway_Stop_Flg1                
            ,MAX(CASE WHEN Call_Limit_Stat IN('F0K','F0P')                                             
                      
                      THEN TO_DATE('19990101' , 'YYYYMMDD')
                      ELSE cast(Stat_Upd_Time as date)
                  END ) AS Oneway_Stop_Dt1
            ,MAX(CASE WHEN Call_Limit_Stat='F0M' 
                      
                      THEN TO_DATE('19990101' , 'YYYYMMDD')
                      ELSE cast(Stat_Upd_Time as date)
                  END ) AS Twoway_Stop_Dt1
				  
	   FROM  BSSDATA.OFR_ASSET_CALL_LIMIT_LOG_A
	   WHERE  cast(Stat_Upd_Time as date)<=TO_DATE('20170608'  ,'YYYYMMDD')
     
       AND  Deal_Time IS NULL
       AND  Call_Limit_Stat IN('F0M','F0K','F0P')
     GROUP BY Asset_Row_Id
)
ORDER BY (Asset_Row_Id)
SEGMENTED BY HASH (Asset_Row_Id) ALL NODES
;
CREATE TABLE
Time: First fetch (0 rows): 304.861 ms. All rows formatted: 304.884 ms
CREATE LOCAL TEMP table OWE_92_A ON COMMIT PRESERVE ROWS
AS(
SELECT  p.Asset_Integ_Id            
            ,p1.ASSET_ROW_ID
            ,SUM(Amt)   Amt
		FROM  BSSDATA.FIN_PG_OWE_STMT_ITEM_D_A p
	LEFT JOIN  BSSDATA.OFR_MAIN_ASSET_HIST_A P1
       ON  P.Asset_Integ_Id=P1.Asset_Integ_Id
      AND  P1.END_DT=DATE'3000-12-31'
	  
	WHERE  Stmt_Dt <= TO_DATE('20170608'  ,'YYYYMMDD')- 91   
    
      AND  FLG='1'
  GROUP BY  p.Asset_Integ_Id
            ,p1.ASSET_ROW_ID
)
ORDER BY Asset_Integ_Id,Asset_Row_Id
SEGMENTED BY HASH (Asset_Row_Id) ALL NODES
;
CREATE TABLE
Time: First fetch (0 rows): 18276.243 ms. All rows formatted: 18276.264 ms
CREATE LOCAL TEMP table MAIN_PRE_1_A ON COMMIT PRESERVE ROWS
AS(
SELECT       P1.Asset_Row_Id
              ,P1.Start_Dt
              ,P1.Stat_Name     
              ,P1.Serv_Start_Dt
              ,P1.Serv_End_Dt       
              ,P1.Owe_Suspend_Name
              ,P1.Pre_Active_Status
              ,P1.Std_Prd_Lvl4_Id
              ,P1.Std_Prd_Lvl4_Name
              ,P1.Std_Prd_Lvl3_Id 
              ,COALESCE(P18.Test_Flg,0) AS Test_Flg                   
             ,(CASE WHEN P1.Stat_Name='已暂停' AND P1.Owe_Suspend_Name='单向' 
                          THEN (CASE WHEN P34.Oneway_Stop_Flg = 1 AND P34.Oneway_Stop_Dt IS NOT NULL
                                    THEN P34.Oneway_Stop_Dt
                                    WHEN P33.Oneway_Stop_Dt1 IS NOT NULL AND P34.Oneway_Stop_Dt IS  NULL
                                    THEN P33.Oneway_Stop_Dt1
                                    ELSE P1.Real_Start_Dt
                                END)
                          ELSE NULL
                      END) AS Oneway_Stop_Dt                  
              ,(CASE WHEN P1.Stat_Name='已暂停' AND P1.Owe_Suspend_Name='双向' 
                          THEN (CASE WHEN P34.Twoway_Stop_Flg = 1 AND P34.Twoway_Stop_Dt IS NOT NULL
                                     THEN P34.Twoway_Stop_Dt
                                     WHEN P33.Twoway_Stop_Dt1 IS NOT NULL  AND P34.Twoway_Stop_Dt IS NULL
                                     THEN P33.Twoway_Stop_Dt1
                                     ELSE P1.Real_Start_Dt
                                END)
                          ELSE NULL
                      END) AS Twoway_Stop_Dt                    
             ,(CASE WHEN P34.Twoway_Stop_Flg = 1 AND P34.Twoway_Stop_Dt IS NOT NULL
                                     THEN P34.Twoway_Stop_Dt
                                     WHEN P33.Twoway_Stop_Dt1 IS NOT NULL  AND P34.Twoway_Stop_Dt IS NULL
                                     THEN P33.Twoway_Stop_Dt1
                                     ELSE NULL
                                END) AS Twoway_Stop_Dt1       
              ,(CASE WHEN P2.Asset_Row_Id IS NOT NULL AND P1.Std_Prd_Lvl4_Id IN (11010501) THEN 1 ELSE 0 END) AS Own_Flg
              ,P1.LATN_ID
			  
        FROM  OFR_MAIN_ASSET_A                        P1
   LEFT JOIN  STOP_ASSET_A                           P34
          ON  P1.Asset_Row_Id=P34.Asset_Row_Id
   LEFT JOIN  STOP_ASSET_1_A                         P33
          ON  P1.Asset_Row_Id=P33.Asset_Row_Id       
   LEFT JOIN  MAIN_FREE_CORP_PAY_A                   P18
          ON  P1.Asset_Row_Id=P18.Asset_Row_Id
   LEFT JOIN  OWE_92_A              P2
          ON  P1.Asset_Row_Id = P2.Asset_Row_Id
         AND  P2.Amt > 0
)
ORDER BY Asset_Row_Id,Std_Prd_Lvl4_Id,Std_Prd_Lvl3_Id
SEGMENTED BY HASH (Asset_Row_Id) ALL NODES;
CREATE TABLE
Time: First fetch (0 rows): 29293.145 ms. All rows formatted: 29293.173 ms
CREATE LOCAL TEMP table MAIN_PRE_2_A ON COMMIT PRESERVE ROWS
AS(
SELECT  P1.*
                 ,(CASE WHEN P1.Std_Prd_Lvl4_Id IN (11010200,11010201,11010202,11010307) AND P20.Stat_Name IS NOT NULL AND P20.Stat_Name IN ('IPAS激活','CRM预占')     THEN '正常开户'
                        WHEN P1.Std_Prd_Lvl4_Id IN (11010200,11010201,11010202,11010307) AND P20.Stat_Name IS NOT NULL AND P20.Stat_Name NOT IN ('IPAS激活','CRM预占') THEN '预开户'
                        ELSE P1.Pre_Active_Status
                   END) AS Pre_Active_Status1
				   
	   FROM    MAIN_PRE_1_A                      P1             
		   
		  
      LEFT JOIN   (SELECT  Asset_Row_Id
                          ,MIN(Stat_Name) AS Stat_Name
						  

                    FROM  BSSDATA.OFR_ASSET_CDSC_HIST_A                   					
                   WHERE  Asset_Row_Id IS NOT NULL
                     AND  Asset_Row_Id <> '-1'
					 
					 AND  Start_Dt<=TO_DATE('20170608'  ,'YYYYMMDD')
                     AND  End_Dt>TO_DATE('20170608'  ,'YYYYMMDD')
                     
                 GROUP BY Asset_Row_Id)                                              P20
             ON  	 P1.Asset_Row_Id=P20.Asset_Row_Id   
)
ORDER BY Asset_Row_Id,Std_Prd_Lvl4_Id,Std_Prd_Lvl3_Id
SEGMENTED BY HASH (Asset_Row_Id) ALL NODES
;
CREATE TABLE
Time: First fetch (0 rows): 23858.426 ms. All rows formatted: 23858.452 ms
CREATE LOCAL TEMP TABLE TMP_SPEED_A ON COMMIT PRESERVE ROWS
AS
(
    SELECT
        ASSET_ROW_ID,
        VAL
    FROM
        (
            SELECT
                ROW_NUMBER() OVER (PARTITION BY P1.ASSET_ROW_ID ORDER BY
                CASE
                    WHEN (P2.VAL IS NOT NULL
                        AND P2.VAL <> '-1')
                    THEN P2.Etl_Dt
                    ELSE P1.Etl_Dt
                END DESC) = 1 AS RANK ,
                P1.ASSET_ROW_ID ,
                CASE
                    WHEN (P2.VAL IS NOT NULL
                        AND P2.VAL <> '-1')
                    THEN P2.VAL
                    ELSE P1.VAL
                END VAL
            FROM
			    BSSDATA.OFR_ASSET_EXI_HIST_A P1
                
            LEFT JOIN
				BSSDATA.OFR_ASSET_EXI_HIST_A P2
                
            ON
                P1.ASSET_ROW_ID = P2.ASSET_ROW_ID
				
			AND P2.Start_Dt<=TO_DATE('20170608','YYYYMMDD')
            AND P2.End_Dt>TO_DATE('20170608' ,'YYYYMMDD')
            
            AND P2.VAL_TYPE_NAME = '使用速率'
            WHERE
			
			P1.Start_Dt<=TO_DATE('20170608' ,'YYYYMMDD')
            AND P1.End_Dt>TO_DATE('20170608','YYYYMMDD')
            
            AND P1.VAL_TYPE_NAME = '下载速率') T
    WHERE
        RANK =1 ) 
ORDER BY (Asset_Row_Id)
SEGMENTED BY HASH (Asset_Row_Id) ALL NODES
;
CREATE TABLE
Time: First fetch (0 rows): 15118.491 ms. All rows formatted: 15118.516 ms
INSERT INTO TMP_SPEED_A
SELECT ASSET_ROW_ID, VAL FROM (
SELECT ROW_NUMBER() OVER (PARTITION BY P1.ASSET_ROW_ID ORDER BY CASE WHEN P1.VAL_TYPE_NAME = '速率' THEN 2
                                                                         WHEN P1.VAL_TYPE_NAME = '端口速率' THEN 1
                                                                    else 0 END DESC) AS RANK
						,P1.ASSET_ROW_ID
						,CASE WHEN P1.VAL_TYPE_NAME = '速率' THEN P1.VAL
                  WHEN P1.VAL_TYPE_NAME = '端口速率' THEN P1.VAL
                ELSE 'ERR'
            END VAL
FROM 				
		BSSDATA.OFR_ASSET_EXI_HIST_A P1
		
INNER JOIN  
		MAIN_PRE_2_A P2
		
        ON  P1.ASSET_ROW_ID = P2.ASSET_ROW_ID
	
		WHERE	P1.Start_Dt<TO_DATE('20170608' ,'YYYYMMDD')
		AND  P1.End_Dt>TO_DATE('20170608'  ,'YYYYMMDD') 
     
	   
       AND 	P1.VAL_TYPE_NAME IN ('速率','端口速率')
       AND  P2.STD_PRD_LVL4_ID IN(14030501,14030500)
) T WHERE RANK = 1       
;
 OUTPUT  
---------
 1784159
(1 row)

Time: First fetch (1 row): 3270.166 ms. All rows formatted: 3270.234 ms
CREATE LOCAL TEMP TABLE OWE_STMT_1_A  ON COMMIT PRESERVE ROWS
AS 
(select   					P1.ASSET_ROW_ID
                    ,P1.Owe_Stmt_Dt
                    ,P1.Stmt_Dt
                    ,SUM(P1.AMT) AS OWE_AMT      
       
	   FROM   BSSDATA.FIN_PG_OWE_STMT_ITEM_D_A   P1
       INNER JOIN		OFR_MAIN_ASSET_A P2       
	   
	   
       				 ON		P1.ASSET_ROW_ID = P2.ASSET_ROW_ID
       				AND   P2.STAT_NAME <> '不活动'
            WHERE   P1.FLG IN ('1','2')
              AND   P1.Bad_Debt_Flg = 'N'
   GROUP BY 1,2,3
)
ORDER BY (ASSET_ROW_ID)
SEGMENTED BY HASH (Asset_Row_Id) ALL NODES
;
CREATE TABLE
Time: First fetch (0 rows): 4802.136 ms. All rows formatted: 4802.158 ms
CREATE LOCAL TEMP table OWE_STMT_2_A ON COMMIT PRESERVE ROWS
AS 
(select             ASSET_ROW_ID
                    ,MAX(CAST(EXTRACT(YEAR FROM Owe_Stmt_Dt) - EXTRACT(YEAR FROM Stmt_Dt) AS INTEGER)*12+CAST(EXTRACT(MONTH FROM Owe_Stmt_Dt)-(EXTRACT(MONTH FROM Stmt_Dt)+1) AS INTEGER)) NBR
					
	  	 FROM    OWE_STMT_1_A             
			
           WHERE    OWE_AMT > 0
           GROUP BY 1
)
ORDER BY (ASSET_ROW_ID)
SEGMENTED BY HASH (Asset_Row_Id) ALL NODES
;
CREATE TABLE
Time: First fetch (0 rows): 424.288 ms. All rows formatted: 424.309 ms
CREATE LOCAL TEMP TABLE NEW_BIL_FLG_A_1 ON COMMIT PRESERVE ROWS
AS
(
		SELECT
							P1.ASSET_ROW_ID
							,CASE WHEN P1.STAT_NAME = '不活动' THEN 0
										WHEN P1.Pre_Active_Status ='预开户' THEN 0
										WHEN P1.STD_PRD_LVL4_ID IN ('11020413','11020419') AND P1.STAT_NAME = '已暂停' 
										
										AND P1.STAT_CHANGE_DT < TO_DATE('20170608' , 'YYYYMMDD')-31 THEN 0
										
										WHEN P1.STD_PRD_LVL4_ID NOT IN ('11020413','11020419') AND P2.ASSET_ROW_ID IS NOT NULL AND P2.NBR >= 3 THEN 0
										ELSE 1
							END AS BIL_FLG
							
			FROM		OFR_MAIN_ASSET_A P1
			LEFT JOIN		OWE_STMT_2_A P2
			
 				ON		P1.ASSET_ROW_ID = P2.ASSET_ROW_ID
)
ORDER BY (ASSET_ROW_ID)
SEGMENTED BY HASH (Asset_Row_Id) ALL NODES
;
CREATE TABLE
Time: First fetch (0 rows): 9886.650 ms. All rows formatted: 9886.672 ms
CREATE LOCAL TEMP TABLE NEW_BIL_FLG_A ON COMMIT PRESERVE ROWS
AS
( SELECT ASSET_ROW_ID,BIL_FLG FROM(
		SELECT ROW_NUMBER () OVER (PARTITION BY P1.ASSET_ROW_ID ORDER BY BIL_FLG)  AS RANK
							,P1.ASSET_ROW_ID
							,CASE WHEN P2.ASSET_ROW_ID IS NOT NULL THEN 0 ELSE P1.BIL_FLG END BIL_FLG
			FROM		
				NEW_BIL_FLG_A_1 P1
				
	LEFT JOIN   
				BSSDATA.OFR_CHILD_ASSET_HIST_A P2
				
        ON    P1.ASSET_ROW_ID = P2.ROOT_ASSET_ROW_ID
		
	    AND    P2.START_DT <= TO_DATE('20170608' ,'YYYYMMDD')
        AND    P2.End_Dt > TO_DATE('20170608'  ,'YYYYMMDD')
      
       AND    P2.CPRD_ROW_ID = '1-HKOIMR0'
       AND    P2.STAT_NAME <> '不活动'
)T WHERE RANK = 1
)
ORDER BY (ASSET_ROW_ID)  
SEGMENTED BY HASH (Asset_Row_Id) ALL NODES
;
CREATE TABLE
Time: First fetch (0 rows): 15406.761 ms. All rows formatted: 15406.785 ms
CREATE LOCAL TEMP table MAIN_PRE_A ON COMMIT PRESERVE ROWS
AS(
SELECT            P1.Asset_Row_Id
                 ,P1.Start_Dt AS Date_Cd
                 ,P1.Std_Prd_Lvl4_Name
                 ,P1.Stat_Name
                 ,P1.Serv_End_Dt
                 ,P1.Std_Prd_Lvl4_Id
                 ,P1.Owe_Suspend_Name
                 ,Pre_Active_Status1
                 ,P1.Oneway_Stop_Dt
                 ,P1.Twoway_Stop_Dt
                 ,(CASE WHEN P1.Std_Prd_Lvl4_Id IN (11010502,11020601,11010200,11010201,11010202,11010307)    
                        THEN ( CASE WHEN P1.Stat_Name = '不活动' THEN 0          
                   WHEN (Pre_Active_Status1 NOT IN ('预开户','移动即买即通') OR Pre_Active_Status1 IS NULL)     
                                         AND P1.Stat_Name <> '不活动'
                                         AND P1.Test_Flg = 0
                                         AND P1.Own_Flg = 0         
                                         AND NOT (COALESCE(P1.Owe_Suspend_Name,'-1') IN ('双向') 
                                                  AND P1.TwoWay_stop_Dt IS NOT NULL
												  
												  AND P1.TwoWay_stop_Dt <= TO_DATE('20170608'  ,'YYYYMMDD')-62
                                                    
                                                  )
                                                 THEN 1                             
                                    ELSE 0
                                    END )
                         WHEN P1.Std_Prd_Lvl4_Id IN (11010501) 
                         THEN ( CASE WHEN P1.Stat_Name = '不活动' THEN 0          
                                 
                                   WHEN (Pre_Active_Status1 NOT IN ('预开户','移动即买即通') OR Pre_Active_Status1 IS NULL)
                                         AND P1.Stat_Name <> '不活动'
                                         AND P1.Test_Flg = 0
                                         AND NOT (P1.Own_Flg = 1 
                                                  AND COALESCE(P1.Owe_Suspend_Name,'-1') IN ('双向') 
                                                  AND P1.TwoWay_stop_Dt IS NOT NULL
												  
												  AND P1.TwoWay_stop_Dt <= TO_DATE('20170608'   ,'YYYYMMDD')-62 
                                                   
                                                  )
                                                 THEN 1                             
                                    ELSE 0
                                    END )
                             ELSE NULL
                   END) AS On_Serv_Flg      
                 
                 
                 
                 
                 
                 
                 
                 
                 
                 
                 
                 
                 
                 
                 
                 ,CASE WHEN P2.ASSET_ROW_ID IS NOT NULL THEN P2.BIL_FLG
                 ELSE 0
                 END AS BIL_FLG  
                   ,(CASE WHEN P1.Stat_Name = '不活动' THEN 0          
                        WHEN Pre_Active_Status1 = '预开户' THEN 0
                        WHEN Pre_Active_Status1 = '移动即买即通' THEN 0   
                        WHEN P16.On_Net_Flg='Y' THEN 1
                        WHEN P1.Std_Prd_Lvl3_Id IN (110202,110204) AND P16.On_Net_Flg IS NULL THEN 1
                        WHEN P16.On_Net_Flg='N' THEN 0 
                        WHEN CAST(cast(P1.Serv_Start_Dt as date) AS CHAR(10))=CAST(TO_DATE('20170608'  ,'YYYYMMDD') AS CHAR(10)) THEN 1
                        ELSE 0
                        END)  AS On_Net_Flg				
                   ,P1.Twoway_Stop_Dt1  
                   ,P1.LATN_ID
                   ,P28.Last_Display_Area_Id
                   ,(CASE when SUBSTR(P17.VAL,LENGTH(P17.VAL)-3, 4)='Kbps' then P17.VAL
											 when SUBSTR(P17.VAL,LENGTH(P17.VAL)-3, 4)='Mbps' then CAST(CAST(SUBSTR(P17.VAL,1,LENGTH(P17.VAL)-4) AS INTEGER)*1024 AS VARCHAR(200))||'Kbps'
											 when SUBSTR(P17.VAL,LENGTH(P17.VAL),1)='M'       then CAST(CAST(SUBSTR(P17.VAL,1,LENGTH(P17.VAL)-1) AS INTEGER)*1024 AS VARCHAR(200))||'Kbps'
											 ELSE 'err'
											 END)  AS Speed
           FROM    MAIN_PRE_2_A                                 P1     
      LEFT JOIN  	 ZJBIC.OFR_MAIN_ASSET_FLG_A             			 P16           
             ON  	 P1.Asset_Row_Id=P16.Asset_Row_Id
            AND 	 P16.Bil_Month='201705'                    
      LEFT JOIN    TMP_SPEED_A P17
             ON    P1.ASSET_ROW_ID = P17.ASSET_ROW_ID     
      LEFT JOIN    ZJBIC.NEW_MARKET_AREA_NAME_A  P28
             ON    P1.Asset_Row_Id=P28.Asset_Row_Id  
      LEFT JOIN    NEW_BIL_FLG_A P2                 
      			 ON		 P1.ASSET_ROW_ID = P2.ASSET_ROW_ID
)
ORDER BY Asset_Row_Id, Std_Prd_Lvl4_Id
SEGMENTED BY HASH (Asset_Row_Id) ALL NODES
;
CREATE TABLE
Time: First fetch (0 rows): 73069.041 ms. All rows formatted: 73069.079 ms
DELETE FROM KPI.KPI_ASSET_FLG_A
WHERE DATE_CD = TO_DATE('20170608'  ,'YYYYMMDD')
   OR (DATE_CD <= TO_DATE('20170608'  ,'YYYYMMDD') - 62 )
;
  OUTPUT  
----------
 20725488
(1 row)

Time: First fetch (1 row): 1163.826 ms. All rows formatted: 1163.872 ms
INSERT INTO KPI.KPI_ASSET_FLG_A
SELECT
Asset_Row_Id
,Date_Cd
,Bil_Flg
,On_Net_Flg
,On_Serv_Flg
,Latn_Id
,Last_Display_Area_Id
,Speed
,Std_Prd_Lvl4_Id
FROM MAIN_PRE_A
WHERE COALESCE(Pre_Active_Status1,'-1') NOT IN ('预开户','移动即买即通') 
;
  OUTPUT  
----------
 20725488
(1 row)

Time: First fetch (1 row): 5909.642 ms. All rows formatted: 5909.688 ms
run_vsql_command() = 0
